{
  "targets": [
    "T01",
    "T02",
    "T03",
    "T04"
  ],
  "launchers": [
    "L01",
    "L02",
    "L03"
  ],
  "time_slots": [
    "S01",
    "S02",
    "S03",
    "S04",
    "S05",
    "S06"
  ],
  "launcher_positions": {
    "L01": [
      2.5,
      1.75
    ],
    "L02": [
      5.0,
      3.5
    ],
    "L03": [
      7.5,
      0.0
    ]
  },
  "target_pip_positions_by_launcher_time": {
    "T01": {
      "L01": {
        "S01": [
          14.9,
          8.5
        ],
        "S02": [
          15.75,
          8.95
        ],
        "S03": [
          16.6,
          9.4
        ],
        "S04": [
          17.45,
          9.85
        ],
        "S05": [
          18.3,
          10.3
        ],
        "S06": [
          19.15,
          10.75
        ]
      },
      "L02": {
        "S01": [
          15.25,
          8.25
        ],
        "S02": [
          16.1,
          8.7
        ],
        "S03": [
          16.95,
          9.15
        ],
        "S04": [
          17.8,
          9.6
        ],
        "S05": [
          18.65,
          10.05
        ],
        "S06": [
          19.5,
          10.5
        ]
      },
      "L03": {
        "S01": [
          15.6,
          8.0
        ],
        "S02": [
          16.45,
          8.45
        ],
        "S03": [
          17.3,
          8.9
        ],
        "S04": [
          18.15,
          9.35
        ],
        "S05": [
          19.0,
          9.8
        ],
        "S06": [
          19.85,
          10.25
        ]
      }
    },
    "T02": {
      "L01": {
        "S01": [
          16.6,
          9.8
        ],
        "S02": [
          17.45,
          10.25
        ],
        "S03": [
          18.3,
          10.7
        ],
        "S04": [
          19.15,
          11.15
        ],
        "S05": [
          20.0,
          11.6
        ],
        "S06": [
          20.85,
          12.05
        ]
      },
      "L02": {
        "S01": [
          16.95,
          9.55
        ],
        "S02": [
          17.8,
          10.0
        ],
        "S03": [
          18.65,
          10.45
        ],
        "S04": [
          19.5,
          10.9
        ],
        "S05": [
          20.35,
          11.35
        ],
        "S06": [
          21.2,
          11.8
        ]
      },
      "L03": {
        "S01": [
          17.3,
          9.3
        ],
        "S02": [
          18.15,
          9.75
        ],
        "S03": [
          19.0,
          10.2
        ],
        "S04": [
          19.85,
          10.65
        ],
        "S05": [
          20.7,
          11.1
        ],
        "S06": [
          21.55,
          11.55
        ]
      }
    },
    "T03": {
      "L01": {
        "S01": [
          18.3,
          11.1
        ],
        "S02": [
          19.15,
          11.55
        ],
        "S03": [
          20.0,
          12.0
        ],
        "S04": [
          20.85,
          12.45
        ],
        "S05": [
          21.7,
          12.9
        ],
        "S06": [
          22.55,
          13.35
        ]
      },
      "L02": {
        "S01": [
          18.65,
          10.85
        ],
        "S02": [
          19.5,
          11.3
        ],
        "S03": [
          20.35,
          11.75
        ],
        "S04": [
          21.2,
          12.2
        ],
        "S05": [
          22.05,
          12.65
        ],
        "S06": [
          22.9,
          13.1
        ]
      },
      "L03": {
        "S01": [
          19.0,
          10.6
        ],
        "S02": [
          19.85,
          11.05
        ],
        "S03": [
          20.7,
          11.5
        ],
        "S04": [
          21.55,
          11.95
        ],
        "S05": [
          22.4,
          12.4
        ],
        "S06": [
          23.25,
          12.85
        ]
      }
    },
    "T04": {
      "L01": {
        "S01": [
          20.0,
          12.4
        ],
        "S02": [
          20.85,
          12.85
        ],
        "S03": [
          21.7,
          13.3
        ],
        "S04": [
          22.55,
          13.75
        ],
        "S05": [
          23.4,
          14.2
        ],
        "S06": [
          24.25,
          14.65
        ]
      },
      "L02": {
        "S01": [
          20.35,
          12.15
        ],
        "S02": [
          21.2,
          12.6
        ],
        "S03": [
          22.05,
          13.05
        ],
        "S04": [
          22.9,
          13.5
        ],
        "S05": [
          23.75,
          13.95
        ],
        "S06": [
          24.6,
          14.4
        ]
      },
      "L03": {
        "S01": [
          20.7,
          11.9
        ],
        "S02": [
          21.55,
          12.35
        ],
        "S03": [
          22.4,
          12.8
        ],
        "S04": [
          23.25,
          13.25
        ],
        "S05": [
          24.1,
          13.7
        ],
        "S06": [
          24.95,
          14.15
        ]
      }
    }
  },
  "launcher_orientation": {
    "L01": [
      0.951057,
      0.309017
    ],
    "L02": [
      0.809017,
      0.587785
    ],
    "L03": [
      0.587785,
      0.809017
    ]
  },
  "heading_vectors": {
    "T01": {
      "L01": {
        "S01": [
          0.878301,
          0.478108
        ],
        "S02": [
          0.878655,
          0.477458
        ],
        "S03": [
          0.878965,
          0.476885
        ],
        "S04": [
          0.879241,
          0.476378
        ],
        "S05": [
          0.879486,
          0.475924
        ],
        "S06": [
          0.879707,
          0.475517
        ]
      },
      "L02": {
        "S01": [
          0.907311,
          0.420461
        ],
        "S02": [
          0.905557,
          0.424225
        ],
        "S03": [
          0.904046,
          0.427436
        ],
        "S04": [
          0.90273,
          0.430207
        ],
        "S05": [
          0.901575,
          0.432624
        ],
        "S06": [
          0.900552,
          0.434749
        ]
      },
      "L03": {
        "S01": [
          0.711485,
          0.702701
        ],
        "S02": [
          0.727126,
          0.686504
        ],
        "S03": [
          0.740282,
          0.672297
        ],
        "S04": [
          0.751483,
          0.659753
        ],
        "S05": [
          0.761122,
          0.648608
        ],
        "S06": [
          0.769497,
          0.638651
        ]
      }
    },
    "T02": {
      "L01": {
        "S01": [
          0.868433,
          0.495807
        ],
        "S02": [
          0.869315,
          0.494259
        ],
        "S03": [
          0.870101,
          0.492874
        ],
        "S04": [
          0.870806,
          0.491626
        ],
        "S05": [
          0.871443,
          0.490498
        ],
        "S06": [
          0.872019,
          0.489471
        ]
      },
      "L02": {
        "S01": [
          0.892176,
          0.451688
        ],
        "S02": [
          0.891624,
          0.452778
        ],
        "S03": [
          0.891139,
          0.45373
        ],
        "S04": [
          0.890711,
          0.45457
        ],
        "S05": [
          0.89033,
          0.455315
        ],
        "S06": [
          0.889989,
          0.455982
        ]
      },
      "L03": {
        "S01": [
          0.725369,
          0.68836
        ],
        "S02": [
          0.737585,
          0.675254
        ],
        "S03": [
          0.748127,
          0.663556
        ],
        "S04": [
          0.757305,
          0.653061
        ],
        "S05": [
          0.765362,
          0.6436
        ],
        "S06": [
          0.772485,
          0.635032
        ]
      }
    },
    "T03": {
      "L01": {
        "S01": [
          0.860601,
          0.50928
        ],
        "S02": [
          0.861801,
          0.507246
        ],
        "S03": [
          0.862883,
          0.505403
        ],
        "S04": [
          0.863864,
          0.503725
        ],
        "S05": [
          0.864757,
          0.50219
        ],
        "S06": [
          0.865574,
          0.500781
        ]
      },
      "L02": {
        "S01": [
          0.880471,
          0.4741
        ],
        "S02": [
          0.880666,
          0.473738
        ],
        "S03": [
          0.880839,
          0.473415
        ],
        "S04": [
          0.880994,
          0.473127
        ],
        "S05": [
          0.881134,
          0.472867
        ],
        "S06": [
          0.88126,
          0.472631
        ]
      },
      "L03": {
        "S01": [
          0.735294,
          0.677749
        ],
        "S02": [
          0.745241,
          0.666795
        ],
        "S03": [
          0.75399,
          0.656886
        ],
        "S04": [
          0.761739,
          0.647884
        ],
        "S05": [
          0.768644,
          0.639677
        ],
        "S06": [
          0.774833,
          0.632166
        ]
      }
    },
    "T04": {
      "L01": {
        "S01": [
          0.854246,
          0.51987
        ],
        "S02": [
          0.855636,
          0.517578
        ],
        "S03": [
          0.856902,
          0.51548
        ],
        "S04": [
          0.858059,
          0.513551
        ],
        "S05": [
          0.859121,
          0.511773
        ],
        "S06": [
          0.860099,
          0.510128
        ]
      },
      "L02": {
        "S01": [
          0.871196,
          0.490935
        ],
        "S02": [
          0.871863,
          0.48975
        ],
        "S03": [
          0.872462,
          0.488681
        ],
        "S04": [
          0.873005,
          0.487712
        ],
        "S05": [
          0.873497,
          0.486829
        ],
        "S06": [
          0.873947,
          0.486021
        ]